gap_id,gap_category,gap_type,clinical_priority,description,kenya_epidemiological_context,affected_populations,current_coverage_assessment,health_system_impact_analysis,clinical_evidence_base,recommended_interventions,resource_requirements,implementation_feasibility,success_metrics,kenya_context_integration,pdf_page_sources,validation_ready,discovered_at,run_number,unique_id
CVD_REHAB_CRITICAL_001,cardiovascular_rehabilitation_services,missing_essential_service,HIGH,Comprehensive cardiovascular rehabilitation services absent despite CVD being a leading cause of hospital admissions and deaths; no structured post-acute rehabilitation across most counties.,"{'disease_burden': 'CVD accounts for ~25% of hospital admissions and ~13% of deaths nationally', 'prevalence_data': 'Hypertension prevalence ~24% of adults (~13.4M adults)', 'current_outcomes': 'High readmission rates, prolonged disability, premature mortality', 'geographic_burden': 'Higher absolute numbers in urban counties but rising CVD burden in rural areas'}","{'primary_population': 'Post-acute cardiovascular patients (post-MI, heart failure, post-revascularisation)', 'estimated_annual_cases': 'Estimated 200,000-350,000 patients needing structured rehabilitation annually (based on admissions share)', 'demographic_profile': 'Predominantly adults 40+, working-age and elderly; urban and peri-urban concentrated', 'vulnerable_groups': 'Rural patients, low-income, uninsured or NHIF informal sector enrollees'}","{'existing_services': 'Limited to a few teaching hospitals and private centres (Kenyatta, Moi, select private hospitals)', 'geographic_availability': 'Available in <10 counties with comprehensive programs; majority of 47 counties lack services', 'capacity_utilization': 'Existing units are over-subscribed with long waitlists (months)', 'wait_times': '4-8 months for assessment in tertiary centres; no community follow-up'}","{'level_1_2_impact': 'No community-based secondary prevention/rehab; CHVs not trained in cardiac rehab follow-up', 'level_3_impact': 'Health centres lack outpatient rehabilitation clinics and trained staff', 'level_4_impact': 'County hospitals have limited physiotherapy and no structured cardiac rehab pathways', 'level_5_6_impact': 'Referral burden on tertiary hospitals for routine rehab; limits capacity for acute care', 'referral_pathway_gaps': 'No standardized discharge planning or linkages to community-level services'}","{'international_guidelines': 'WHO/ISC guidelines and international cardiac societies recommend multidisciplinary rehab', 'clinical_effectiveness': 'Cardiac rehab reduces mortality 13-20% and readmissions ~25%, improves functional status', 'timing_criticality': 'Interventions most effective in first 12 weeks post-event', 'cost_effectiveness': 'Structured rehab shown to be cost-saving over medium term by reducing readmissions'}","{'immediate_additions': ['Establish cardiac rehab units in all Level 5-6 hospitals', 'Develop outpatient/community-based cardiac rehab models using physiotherapists and CHVs', 'Include cardiac rehabilitation package within NHIF and PHC Fund benefit packages'], 'service_specifications': ['Multidisciplinary teams: cardiology, physiotherapy, nutrition, mental health, nursing', 'Minimum 12-week structured program with individualised plans and community follow-up', 'Standardised clinical pathways and discharge plans linking to county services'], 'implementation_phases': ['Phase 1 (0-6 months): Pilot in 8 high-burden counties (Nairobi, Mombasa, Kisumu, Nakuru, Kiambu, Machakos, Uasin Gishu, Kakamega)', 'Phase 2 (6-18 months): Scale to all county referral hospitals (Level 5)', 'Phase 3 (18-36 months): Integrate community-based rehab via CHVs and primary care']}","{'human_resources': 'Training: 800 physiotherapists, 400 cardiac nurses, 150 cardiac rehab coordinators over 3 years', 'infrastructure': 'Rehab rooms, exercise equipment, patient monitoring tools, tele-rehab platform for rural linkage', 'training_needs': 'Short-course certification in cardiac rehab, continuing education for CHVs and primary care clinicians', 'estimated_cost': 'KES 4.2B - KES 6.0B over 3 years (equipment, training, recurrent costs)'}","{'technical_feasibility': 'HIGH - leverages existing cardiology services and physiotherapy cadres', 'financial_feasibility': 'MEDIUM - requires earmarked funds but high ROI via reduced admissions', 'political_feasibility': 'HIGH - aligns with NCD strategy and UHC ambitions', 'timeline_realistic': '3 years for nationwide basic coverage; advanced services longer'}","{'process_indicators': 'Number of facilities offering cardiac rehab; number of patients enrolled and completing 12-week program', 'outcome_indicators': '30-day and 1-year CVD readmission rates; functional capacity scores (6MWT)', 'impact_indicators': 'CVD mortality rates; DALYs averted', 'equity_indicators': 'Proportion of counties with at least one rehab service; rural:urban access ratio'}","{'county_variations': 'Urban counties to host advanced rehab hubs; rural counties to prioritise community models', 'cultural_considerations': 'Use family-centred education; engage local leaders for lifestyle interventions', 'integration_opportunities': 'Link with NCD programs, CHS, NHIF benefit design, and county disaster plans', 'sustainability_factors': 'County budget allocation, task-shifting to physiotherapists and CHVs, NHIF reimbursement'}",['Pages 1-18 (Policy Structure)'],True,2025-08-27T19:47:08.611648,2,GAP_001
CANCER_EARLY_DETECTION_002,cancer_screening_diagnostic_treatment,incomplete_service_package,HIGH,"Gaps across the cancer care continuum—screening, diagnostics, timely referral, and affordable treatment—contributing to late presentation and high mortality.","{'disease_burden': 'Cancer is the second leading cause of registered deaths nationally', 'prevalence_data': 'Rising incidence with cervical, breast, prostate, and oesophageal cancers common', 'current_outcomes': 'Late-stage presentation common; low 5-year survival for many cancers', 'geographic_burden': 'Diagnostic and treatment services concentrated in urban tertiary centres'}","{'primary_population': 'Adults at risk of common cancers (women for cervical/breast; men for prostate; older adults)', 'estimated_annual_cases': 'Tens of thousands of new cancer cases annually (national registries indicate rising trend)', 'demographic_profile': 'Disproportionate mortality among rural residents due to access barriers', 'vulnerable_groups': 'Poor, rural, uninsured, and women with limited screening access'}","{'existing_services': 'Screening services (VIA, mammography) and diagnostics limited; radiotherapy centres are few', 'geographic_availability': 'Radiotherapy located in few counties (e.g., Nairobi, Eldoret); imaging and pathology limited in county hospitals', 'capacity_utilization': 'Radiotherapy and oncology clinics overloaded; long waits for diagnostics and treatment', 'wait_times': 'Diagnostic delays of weeks to months; radiotherapy waitlists >3 months in some areas'}","{'level_1_2_impact': 'Limited community-level awareness and screening linkages; CHVs not fully leveraged for screening', 'level_3_impact': 'Health centres lack diagnostic capacity (basic pathology, ultrasound) for early detection', 'level_4_impact': 'County hospitals need oncology units, pathology, and Palliative care integration', 'level_5_6_impact': 'Tertiary centres overwhelmed; referral bottlenecks delay treatment initiation', 'referral_pathway_gaps': 'No standardized fast-track for suspected cancer; poor specimen transport systems'}","{'international_guidelines': 'WHO recommends organized screening for cervical and breast cancer where resources permit; timely access to diagnostics and treatment', 'clinical_effectiveness': 'Screening and early treatment substantially improve survival (e.g., cervical cancer treatable when detected early)', 'timing_criticality': 'Early diagnosis within weeks of suspicion improves outcomes', 'cost_effectiveness': 'Cervical screening (VIA+HPV testing) and HPV vaccination are high-impact, cost-effective interventions'}","{'immediate_additions': ['Scale cervical cancer screening (VIA/HPV) and breast clinical exam plus referral pathways in all Level 3-4 facilities', 'Establish hub-and-spoke diagnostic networks (pathology and imaging) with specimen transport and telepathology', 'Expand radiotherapy capacity and subsidise chemotherapy through NHIF/PHC Fund'], 'service_specifications': ['Screening protocols, clear referral criteria, rapid diagnostic pathways (≤30 days)', 'Minimum pathology turnaround times and imaging availability at county referral hospitals', 'Integrated palliative care services at Level 4-6'], 'implementation_phases': ['Phase 1 (0-12 months): National scale-up of cervical screening and HPV vaccination catch-up campaigns in high-burden counties', 'Phase 2 (12-36 months): Establish regional diagnostic hubs (pathology, imaging) linked to counties', 'Phase 3 (36-60 months): Expand treatment capacity (radiotherapy machines, oncology training) and financial protection']}","{'human_resources': 'Train 1,500 clinicians in screening/diagnostic algorithms, 200 pathologists/technologists via telepathology support', 'infrastructure': 'Upgrade pathology labs, purchase additional radiotherapy units (LINAC), expand mammography access, specimen transport systems', 'training_needs': 'Oncology nursing, chemotherapy safety, palliative care training', 'estimated_cost': 'KES 15B - KES 25B phased over 5 years (diagnostics, radiotherapy expansion, training, HPV vaccination scale-up)'}","{'technical_feasibility': 'MEDIUM - requires capital investment and workforce scaling; telemedicine can mitigate pathology gaps', 'financial_feasibility': 'MEDIUM-LOW - high capital costs but high impact; options include donor financing and phased scale-up', 'political_feasibility': 'HIGH - cancer control is a national priority with public support', 'timeline_realistic': '5 years for substantial national coverage of screening and diagnostic networks'}","{'process_indicators': 'Proportion of eligible women screened for cervical/breast cancer; number of counties with diagnostic hubs', 'outcome_indicators': 'Stage at diagnosis distribution shifting to earlier stages; time from suspicion to treatment initiation', 'impact_indicators': 'Cancer-specific mortality rates and survival at 1 and 5 years', 'equity_indicators': 'Rural:urban screening and treatment access ratios; financial catastrophic expenditure rates for cancer patients'}","{'county_variations': 'Prioritise high-burden counties for early investment; link HPV vaccination with school health programs', 'cultural_considerations': 'Address stigma and gender barriers to screening via community engagement and male involvement', 'integration_opportunities': 'Integrate screening into reproductive health, HIV clinics, and school health services', 'sustainability_factors': 'NHIF inclusion, county budget lines for oncology, public-private partnerships for radiotherapy'}","['Pages 1-18 (Policy Structure)', 'Pages 19-54 (Annex Procedures)']",True,2025-08-27T19:47:08.613377,2,GAP_002
PNEUMONIA_CHILD_ACUTE_003,acute_respiratory_infections_child_health,service_access_and_quality_gap,HIGH,"Pneumonia remains the leading cause of registered deaths; gaps in prevention (vaccination, nutrition), early recognition, oxygen therapy, and referral lead to high child mortality.","{'disease_burden': 'Pneumonia is the leading cause of registered deaths nationally, especially in children under 5', 'prevalence_data': 'High incidence in rural and poor urban informal settlements', 'current_outcomes': 'High under-5 mortality attributable to pneumonia; delays in care-seeking and limited oxygen availability worsen outcomes', 'geographic_burden': 'Rural counties and informal urban settlements disproportionately affected'}","{'primary_population': 'Children under 5, particularly infants and malnourished children', 'estimated_annual_cases': 'Hundreds of thousands of acute respiratory infection episodes annually; subset requiring hospitalization estimated at 50,000-100,000', 'demographic_profile': 'Higher incidence in rural, low-income households; seasonal peaks during cool/dry months', 'vulnerable_groups': 'Malnourished children, HIV-exposed/infected children, households with indoor air pollution'}","{'existing_services': 'IMCI implemented variably; oxygen supply unreliable at many Level 3-4 facilities; pulse oximetry coverage limited', 'geographic_availability': 'Oxygen concentrators and functioning supply chains concentrated in tertiary hospitals; many rural facilities lack continuous oxygen', 'capacity_utilization': 'Referral hospitals see seasonal surges and bed shortages', 'wait_times': 'Transportation delays for referrals; significant time to oxygen initiation in some facilities'}","{'level_1_2_impact': 'Community recognition and early care-seeking limited; CHVs under-resourced for referral facilitation', 'level_3_impact': 'Primary health centres lack reliable oxygen, pulse oximeters, and trained staff for IMCI classification', 'level_4_impact': 'County hospitals sometimes have oxygen but intermittent supply and limited paediatric critical care capacity', 'level_5_6_impact': 'Tertiary paediatric units overwhelmed during peaks', 'referral_pathway_gaps': 'Poor emergency transport and referral communication; no standard oxygen-sparing protocols at lower levels'}","{'international_guidelines': 'WHO IMCI and oxygen therapy guidelines emphasise pulse oximetry and oxygen as essential medicines', 'clinical_effectiveness': 'Timely oxygen therapy reduces pneumonia mortality significantly; IMCI reduces mortality when implemented well', 'timing_criticality': 'Early detection and oxygen within hours are life-saving', 'cost_effectiveness': 'Pulse oximetry and oxygen concentrators are highly cost-effective interventions in LMICs'}","{'immediate_additions': ['Universal roll-out of pulse oximetry and oxygen concentrators to all Level 3-4 facilities with maintenance plans', 'Strengthen IMCI implementation and CHV training for early recognition and referral', 'Vaccination scale-up (PCV, Hib, influenza where appropriate) and integrate with nutrition programs'], 'service_specifications': ['Standard paediatric oxygen protocols, oxygen delivery devices, and oxygen-sparing strategies', 'Emergency referral protocols with functional transport linkage', 'Maintenance contracts and oxygen supply chain management'], 'implementation_phases': ['Phase 1 (0-6 months): Prioritise high-mortality counties for equipment and training', 'Phase 2 (6-18 months): Scale to all Level 3-4 facilities and strengthen county oxygen systems', 'Phase 3 (18-36 months): Integrate with broader child health (nutrition, vaccination) and monitor outcomes']}","{'human_resources': 'Training for 5,000 clinicians and CHVs in IMCI, oxygen therapy, and pulse oximetry use', 'infrastructure': 'Pulse oximeters for every facility seeing children, 2-3 oxygen concentrators per Level 3-4 facility, backup power where needed', 'training_needs': 'IMCI refreshers, oxygen maintenance training for biomedical engineers', 'estimated_cost': 'KES 800M - KES 1.5B over 2 years (equipment, training, supply chain strengthening)'}","{'technical_feasibility': 'HIGH - technology is proven and available; maintenance is main constraint', 'financial_feasibility': 'HIGH - relatively low cost with large mortality reduction; potential donor support', 'political_feasibility': 'HIGH - child survival is a national priority', 'timeline_realistic': '12-24 months for equipment roll-out and training; measurable mortality impact within 1 year'}","{'process_indicators': 'Proportion of facilities with functioning pulse oximeters and continuous oxygen supply; IMCI coverage rates', 'outcome_indicators': 'Under-5 pneumonia case fatality rate; time-to-oxygen initiation', 'impact_indicators': 'Reduction in pneumonia-attributable under-5 deaths', 'equity_indicators': 'Coverage in rural vs urban facilities; reductions in county-level pneumonia mortality disparities'}","{'county_variations': 'Target counties with highest under-5 mortality first (Northern and Western high-burden areas)', 'cultural_considerations': ""Use CHVs and mothers' groups to improve care-seeking and adherence to referrals"", 'integration_opportunities': 'Link oxygen and IMCI strengthening to county emergency preparedness and maternal/neonatal services', 'sustainability_factors': 'County procurement plans, maintenance agreements, integration into PHC Fund and immunisation programs'}",['Pages 1-18 (Policy Structure)'],True,2025-08-27T19:47:08.616202,2,GAP_003
EMOC_MATERNAL_EMERGENCY_004,emergency_obstetric_and_newborn_care,critical_service_gap,HIGH,"Persistent maternal mortality (MMR 130-170/100,000) with gaps in emergency obstetric care, surgical capacity (CS), blood transfusion services, and neonatal resuscitation across counties.","{'disease_burden': 'Maternal mortality remains unacceptably high with marked county variation', 'prevalence_data': 'Obstetric haemorrhage, hypertensive disorders, sepsis are leading contributors to maternal deaths', 'current_outcomes': 'Delays in referral, limited blood and surgical capacity contribute to preventable deaths', 'geographic_burden': 'Rural and remote counties have worst outcomes due to distance and facility limitations'}","{'primary_population': 'Pregnant and recently delivered women, neonates requiring emergency care', 'estimated_annual_cases': 'Approximately tens of thousands of obstetric emergencies annually requiring EmOC', 'demographic_profile': 'Higher risks in adolescents, multiparous women, and marginalised groups', 'vulnerable_groups': 'Women in remote/rural counties, low socio-economic status, adolescent mothers'}","{'existing_services': 'Basic EmOC available variably; comprehensive EmOC (surgery, anesthesia, blood transfusion) lacking in many Level 4-5 facilities', 'geographic_availability': 'Level 5-6 provide most CEmOC; many Level 4 lack 24/7 surgical/anesthesia coverage', 'capacity_utilization': 'Operating theatres and blood banks concentrated in urban centres leading to referral delays', 'wait_times': 'Delays for CS and blood transfusion reported; transport delays for referrals common'}","{'level_1_2_impact': 'Community recognition and birth preparedness gaps; referral initiation delayed', 'level_3_impact': 'Health centres may stabilise but often cannot provide CS/blood leading to referrals', 'level_4_impact': 'County hospitals often lack full-time surgical/anesthesia teams and blood transfusion services', 'level_5_6_impact': 'Tertiary centres overwhelmed with referrals that could have been managed at county level', 'referral_pathway_gaps': 'No guaranteed emergency transport; weak communication and standardized referral protocols'}","{'international_guidelines': 'WHO EmOC signal functions recommend availability of CS, blood transfusion, and neonatal resuscitation at designated levels', 'clinical_effectiveness': 'Timely EmOC reduces maternal and perinatal mortality dramatically', 'timing_criticality': 'Minutes to hours are critical for haemorrhage and eclampsia management', 'cost_effectiveness': 'Investments in EmOC provide high returns in lives saved per dollar'}","{'immediate_additions': ['Ensure all Level 4-5 facilities designated for CEmOC have 24/7 surgical, anesthesia, and blood transfusion capability', 'Strengthen emergency transport systems and referral communications', 'Scale neonatal resuscitation training and essential newborn care in all birth points'], 'service_specifications': ['Functional blood transfusion services with cold chain and donation mobilisation', 'Operating theatre with trained surgical/anesthesia teams, obstetric ICU beds at Level 5', 'Standard EmOC service package and performance monitoring'], 'implementation_phases': ['Phase 1 (0-6 months): Gap assessment and rapid upgrades in high MMR counties (surgical staff posting, blood supplies)', 'Phase 2 (6-24 months): Scale 24/7 CEmOC coverage to all designated Level 4-5 facilities', 'Phase 3 (24-48 months): Strengthen referral ambulances and community birth preparedness programs']}","{'human_resources': 'Recruit/post obstetric surgeons, anesthetists, midwives; train 2,000 midwives in emergency obstetric skills', 'infrastructure': 'Upgrade theatres, blood bank fridges, essential obstetric equipment, neonatal special-care units', 'training_needs': 'BEmONC/CEmONC training, blood safety and transfusion protocols, simulation-based neonatal resuscitation', 'estimated_cost': 'KES 6B - KES 10B over 3 years for scaling CEmOC and strengthening referrals'}","{'technical_feasibility': 'MEDIUM - requires workforce redistribution and capital upgrades', 'financial_feasibility': 'MEDIUM - substantial but fundable through PHC Fund, county budgets, and partners', 'political_feasibility': 'HIGH - maternal health is politically salient and tracked by counties', 'timeline_realistic': '2-4 years for functional nationwide CEmOC coverage at designated facilities'}","{'process_indicators': 'Proportion of designated facilities providing 24/7 CEmOC, number of functional ambulances for obstetric referrals', 'outcome_indicators': 'Facility-based maternal mortality ratio, obstetric case fatality rate', 'impact_indicators': 'Reduction in national MMR and perinatal mortality rates', 'equity_indicators': 'Reduction in inter-county disparities in MMR'}","{'county_variations': 'Counties with high MMR require prioritised investments and human resource incentives', 'cultural_considerations': 'Address traditional birth attendant roles via respectful maternity care and community engagement', 'integration_opportunities': 'Link with NHIF maternity benefit, county referral networks, and ambulance services', 'sustainability_factors': 'County budget commitments, task-shifting, retention incentives for rural postings'}","['Pages 1-18 (Policy Structure)', 'Pages 19-54 (Annex Procedures)']",True,2025-08-27T19:47:08.619178,2,GAP_004
